AR_Ref,FA_CodeFamille,AR_Design,Colonne1, AR_PrixVen, Stock_TOTAL
AF5XHD,ACCPOINT,UBIQUITI AIRFIBER AF-5XHD ACCESS POINT WIFI,ACCESS POINT & REPETITEUR,300000,5
APACLITE,ACCPOINT,UBIQUITI UNIFI UAP-AC-LITE ACCESS POINT WIFI UAP AC LITE,ACCESS POINT & REPETITEUR,95000,0
APACPRO,ACCPOINT,UBIQUITI UNIFI UAP AC PRO ACCESS POINT WIFI,ACCESS POINT & REPETITEUR,140000,0
CPE210,ACCPOINT,TP-LINK CPE210 Point d'accès extérieur Wi-Fi N 300 Mbps 2.4GHz 9 dBi,ACCESS POINT & REPETITEUR,30000,7
CPE510,ACCPOINT,TP-LINK CPE510,ACCESS POINT & REPETITEUR,35000,5
CPE520,ACCPOINT,TP-LINK CPE520,ACCESS POINT & REPETITEUR,50000,1
CPE605,ACCPOINT,TP-LINK CPE605,ACCESS POINT & REPETITEUR,40000,0
CPE610,ACCPOINT,TP-LINK EAP610-Outdoor,ACCESS POINT & REPETITEUR,130000,5
DAP1360,ACCPOINT,D-LINK DAP-1360 ACCESS POINT WIFI RANGE EXTENDER,ACCESS POINT & REPETITEUR,16000,100
DAP1520,ACCPOINT,D LINK REPETEUR WIFI DAP-1520,ACCESS POINT & REPETITEUR,25000,6
EAP110,ACCPOINT,TP-LINK EAP110,ACCESS POINT & REPETITEUR,32500,7
EAP110OUTDOOR,ACCPOINT,TP-LINK EAP110 Outdoor,ACCESS POINT & REPETITEUR,32500,65
EAP115,ACCPOINT,TP-LINK EAP115,ACCESS POINT & REPETITEUR,35000,11
EAP120,ACCPOINT,TP-LINK EAP120,ACCESS POINT & REPETITEUR,50000,0
EAP220,ACCPOINT,TP-LINK EAP220,ACCESS POINT & REPETITEUR,70000,2
EAP225,ACCPOINT,TP-LINK EAP225,ACCESS POINT & REPETITEUR,75000,8
EAP225OUT,ACCPOINT,TP-LINK EAP225-OUTDOOR,ACCESS POINT & REPETITEUR,85000,9
EAP320,ACCPOINT,TP-LINK EAP320,ACCESS POINT & REPETITEUR,95000,6
EAP330,ACCPOINT,TP-LINK EAP330,ACCESS POINT & REPETITEUR,150000,1
LBE5ACGEN2,ACCPOINT,UBIQUITI LITEBEAM AIRMAX AC LBE-5AC-GEN2 ACCESS POINT WIFI EXTERIEUR,ACCESS POINT & REPETITEUR,65000,19
LBEM523,ACCPOINT,UBIQUITI LITEBEAM AIRMAX LBE-M5-23 ACCESS POINT WIFI EXTERIEUR 23DBI,ACCESS POINT & REPETITEUR,45000,13
LOCOM2,ACCPOINT,UBIQUITI LOCO M2 ACCESS POINT WIFI EXTERIEUR,ACCESS POINT & REPETITEUR,50000,10
NBE5ACGEN2,ACCPOINT,UBIQUITI NANOBEAM AIRMAX AC NBE-5AC-GEN2 ACCESS POINT WIFI,ACCESS POINT & REPETITEUR,80000,4
NS5AC,ACCPOINT,UBIQUITI AIRMAX AC CPE NANOSTATION AC NS-5AC ACCESS POINT WIFI,ACCESS POINT & REPETITEUR,110000,4
NSM2,ACCPOINT,UBIQUITI NANOSTATION M2 NSM2 ACCESS POINT WIFI EXTERIEUR,ACCESS POINT & REPETITEUR,70000,7
NSM5,ACCPOINT,UBIQUITI NANOSTATION M5 NSM5 ACCESS POINT WIFI EXTERIEUR,ACCESS POINT & REPETITEUR,85000,2
OC200,ACCPOINT,TP-LINK Omada OC200,ACCESS POINT & REPETITEUR,65000,6
PBE5AC620,ACCPOINT,UBIQUITI POWERBEAM AIRMAX AC PBE-5AC-620 ACCESS POINT WIFI EXTERIEUR,ACCESS POINT & REPETITEUR,150000,9
PBEM5400,ACCPOINT,UBIQUITI POWERBEAM PBE-M5-400 ACCESS POINT WIFI EXTERIEUR,ACCESS POINT & REPETITEUR,80000,6
RE210,ACCPOINT,TP-LINK RE210,ACCESS POINT & REPETITEUR,27500,0
RE3000,ACCPOINT,LINKSYS RE-3000,ACCESS POINT & REPETITEUR,27500,0
RE305,ACCPOINT,TP-LINK RE305,ACCESS POINT & REPETITEUR,30000,0
RE355,ACCPOINT,TP-LINK RE355,ACCESS POINT & REPETITEUR,35000,0
RE360,ACCPOINT,TP-LINK RE360,ACCESS POINT & REPETITEUR,45000,0
RE450,ACCPOINT,TP-LINK RE450 Répéteur de signal WiFi AC1750 Mbps Dual-Band,ACCESS POINT & REPETITEUR,45000,20
RE500,ACCPOINT,TP-LINK RE550 WIFI RANGE EXTENDER,ACCESS POINT & REPETITEUR,60000,2
RE505X,ACCPOINT,TP-LINK RE505X,ACCESS POINT & REPETITEUR,60000,7
RE580D,ACCPOINT,TP-LINK RE580D,ACCESS POINT & REPETITEUR,80000,0
RE650,ACCPOINT,TP-LINK RE650 Répéteur de signal WiFi AC2600 Mbps Dual-Band,ACCESS POINT & REPETITEUR,65000,4
TENA9,ACCPOINT,TENDA EXTENDER TDE-A9,ACCESS POINT & REPETITEUR,12000,27
TENAP4,ACCPOINT,TENDA 300MBPS ACCESS POINT AP4,ACCESS POINT & REPETITEUR,17000,71
TENAP5,ACCPOINT,TENDA 300MBPS ACCESS POINT AP5,ACCESS POINT & REPETITEUR,20000,0
TLCPE220,ACCPOINT,"TP-LINK CPE220 Point d'accès extérieur Wi-Fi N 2,4 GHz 300 Mbps 12 dB",ACCESS POINT & REPETITEUR,35000,0
TLCPE610,ACCPOINT,TP-LINK CPE610,ACCESS POINT & REPETITEUR,50000,2
TLRE200,ACCPOINT,TP-LINK EXTENDER WIFI RE200,ACCESS POINT & REPETITEUR,20000,86
TLWA701ND,ACCPOINT,TP-LINK TL-WA701ND,ACCESS POINT & REPETITEUR,13000,0
TLWA7510N,ACCPOINT,TP-LINK TL-WA7510N,ACCESS POINT & REPETITEUR,45000,0
TLWA801ND,ACCPOINT,TP-LINK TL-WA801ND,ACCESS POINT & REPETITEUR,16000,12
TLWA850RE,ACCPOINT,TP-LINK TL-WA850RE,ACCESS POINT & REPETITEUR,15000,15
TLWA855RE,ACCPOINT,TP-LINK EXTENDER TL-WA855RE,ACCESS POINT & REPETITEUR,17500,104
TLWA860RE,ACCPOINT,TP-LINK TL-WA860RE EXTENDER WIFI,ACCESS POINT & REPETITEUR,20000,87
TLWA901ND,ACCPOINT,TP-LINK TL-WA901ND,ACCESS POINT & REPETITEUR,25000,123
UAPACHD,ACCPOINT,UBIQUITI UNIFI UAP-AC-HD ACCESS POINT WIFI,ACCESS POINT & REPETITEUR,225000,9
UAPACIW,ACCPOINT,UBIQUITI UNIFI UAP-AC-IW ACCESS POINT WIFI UAP-AC-WALL,ACCESS POINT & REPETITEUR,85000,7
UAPACLR,ACCPOINT,UBIQUITI UNIFI UAP AC LR ACCESS POINT WIFI INTERIEUR,ACCESS POINT & REPETITEUR,105000,0
UAPACM,ACCPOINT,UBIQUITI UNIFI UAP-AC-MESH ACCESS POINT WIFI,ACCESS POINT & REPETITEUR,120000,0
UAPACMPRO,ACCPOINT,UBIQUITI UNIFI UAP-AC-M-PRO ACCESS POINT WIFI,ACCESS POINT & REPETITEUR,150000,2
UAPACPRO3,ACCPOINT,UBIQUITI UNIFI UAP AC PRO 3 PACK 3 ACCESS POINT WIFI,ACCESS POINT & REPETITEUR,300000,0
UAPNANOHD,ACCPOINT,UBIQUITI UNIFI UAP-NANOHD ACCESS POINT WIFI NANO HD,ACCESS POINT & REPETITEUR,140000,9
UCCK,ACCPOINT,UBIQUITI CLOUD KEY UC-CK ACCESS POINT WIFI,ACCESS POINT & REPETITEUR,70000,4
UCKG2,ACCPOINT,UBIQUITI UNIFI CLOUD KEY GEN2 UCK-G2 ACCESS POINT WIFI,ACCESS POINT & REPETITEUR,140000,3
UCKG2PLUS,ACCPOINT,UBIQUITI UNIFI CLOUD KEY GEN2 PLUS / UCK-G2-PLUS ACCESS POINT WIFI,ACCESS POINT & REPETITEUR,190000,8
WBS210,ACCPOINT,TP-LINK WBS210,ACCESS POINT & REPETITEUR,55000,1
WBS510,ACCPOINT,TP-LINK WBS510,ACCESS POINT & REPETITEUR,35000,0
WR01,ACCPOINT,WIRELESS-N WIFI REPEATER WR01 / WR01B / REPETITEUR WIFI,ACCESS POINT & REPETITEUR,6000,456
WR03,ACCPOINT,WIRELESS-N WIFI REPEATER WR03 / REPETITEUR WIFI / FORME BOITE,ACCESS POINT & REPETITEUR,6000,129
ROCKETM2,ACCPOINT,UBIQUITI ROCKET M2 ACCESS POINT WIFI EXTERIEUR,ACCESS POINT & REPETITEUR,70000,2
ROCKETM5,ACCPOINT,UBIQUITI ROCKET M5 ACCESS POINT WIFI EXTERIEUR,ACCESS POINT & REPETITEUR,75000,1
EAP225W,ACCPOINT,TP-LINK EAP225-WALL PLATE ACCESS POINT,ACCESS POINT & REPETITEUR,50000,1
EAP235W,ACCPOINT,TP-LINK EAP235-WALL PLATE ACCESS POINT,ACCESS POINT & REPETITEUR,72500,2
EAP115W,ACCPOINT,TP-LINK EAP115-WALL PLATE ACCESS POINT,ACCESS POINT & REPETITEUR,30000,2
UAPACPRO5P,ACCPOINT,UBIQUITI UNIFI UAP AC PRO 5 Pack ACCESS POINT WIFI,ACCESS POINT & REPETITEUR,500000,0
EAP265,ACCPOINT,TP-LINK EAP265 HD / AC1750 EAP-265,ACCESS POINT & REPETITEUR,150000,3
EAP620,ACCPOINT,TP-LINK EAP620 HD / AX1800,ACCESS POINT & REPETITEUR,155000,2
EAP245,ACCPOINT,TP-LINK EAP245 / AC1750,ACCESS POINT & REPETITEUR,90000,2
EAP660,ACCPOINT,TP-LINK EAP660 HD / AX3600,ACCESS POINT & REPETITEUR,230000,1
TLRE365,ACCPOINT,TP-LINK RE365,ACCESS POINT & REPETITEUR,32500,8
DECE4,ACCPOINT,TP-LINK deco E4 / AC1200,ACCESS POINT & REPETITEUR,120000,1
DECM3W,ACCPOINT,TP-LINK deco M3W / AC1200,ACCESS POINT & REPETITEUR,30000,5
DECE3,ACCPOINT,TP-LINK deco E3 / AC1200,ACCESS POINT & REPETITEUR,75000,2
LOCOM5,ACCPOINT,Ubiquiti Loco M5 Point d'accès/CPE extérieur Wi-Fi B/G 5 GHz PoE,ACCESS POINT & REPETITEUR,60000,14
R5ACLITE,ACCPOINT,Ubiquiti Rocket R5AC-Lite Point d'accès extérieur Wi-Fi AC 500+Mbps,ACCESS POINT & REPETITEUR,125000,5
UNIFI6,ACCPOINT,Ubiquiti Unifi U6-LR Point d'accès intérieur Wi-Fi 6 Dual Band AX3000,ACCESS POINT & REPETITEUR,165000,6
AMO5G13,ACCPOINT,Ubiquiti airMAX Omni AMO-5G13 Antenne Omnidirectionnelle 5ghz 13dBi,ACCESS POINT & REPETITEUR,180000,3
RB951UI2ND,ACCPOINT,MIKROTIK RB951Ui-2ND Routeur sans fil,ACCESS POINT & REPETITEUR,50000,0
RB951UI2HND,ACCPOINT,MIKROTIK RB951Ui-2HND Routeur sans fil,ACCESS POINT & REPETITEUR,70000,0
RB951G2HND,ACCPOINT,MIKROTIK RB951G-2HND Routeur sans fil,ACCESS POINT & REPETITEUR,80000,27
OC300,ACCPOINT,TP-LINK Omada OC300,ACCESS POINT & REPETITEUR,150000,4
U6LITE,ACCPOINT,Ubiquiti Access Point WiFi 6 Lite (U6-Lite) Point d'accès intérieur,ACCESS POINT & REPETITEUR,120000,51
B14SM001,ACCCOIFF,KIKI NEW GAIN UV STERILIZER B14-SM001,ACCESSOIRE COIFFEUR,15000,1
B21HB002,ACCCOIFF,KIKI BROSSE COIFFURE B21-HB002 / B21-BS002 / BROSSE EN BOIS PM,ACCESSOIRE COIFFEUR,1000,502
B21NP048A/B,ACCCOIFF,KIKI PAPIER COU  BLANC /NECK PAPER WHITE B21-NP048A/B / NECK RUFFLES,ACCESSOIRE COIFFEUR,800,1990
B25SM001,ACCCOIFF,KIKI NEW GAIN UV STERILIZER B25-SM001,ACCESSOIRE COIFFEUR,15000,0
B38BS004,ACCCOIFF,LAME TONDEUSE B38BS004,ACCESSOIRE COIFFEUR,1500,0
B39SM002,ACCCOIFF,MACHINE A STERILISER NEW GAIN KIKI B39-SM002/RTD-208A,ACCESSOIRE COIFFEUR,30000,0
B39SM003,ACCCOIFF,MACHINE A STERILISER NEW GAIN KIKI B39-SM003,ACCESSOIRE COIFFEUR,40000,0
B47CH002,ACCCOIFF,CHAISE DE BARBIER / COIFFURE B47-CH002A,ACCESSOIRE COIFFEUR,210000,17
B61GC001,ACCCOIFF,WMARK DENT TONDEUSE 2-PACK PREMIUM METAL  B61-GC001/ 002 GUIDE 1/16,ACCESSOIRE COIFFEUR,1000,3314
B61GC002,ACCCOIFF,WMARK DENT TONDEUSE 4-PACK PREMIUM METAL CLIP B61-GC002,ACCESSOIRE COIFFEUR,1500,0
B61GC003,ACCCOIFF,WMARK DENT TONDEUSE 6-PACK PREMIUM METAL CLIP B61-GC003 / 3/8 1/2,ACCESSOIRE COIFFEUR,2000,4558
B61GC004,ACCCOIFF,WMARK DENT TONDEUSE 8-PACK PREMIUM METAL CLIP B61-GC004 / GUIDE COMBO,ACCESSOIRE COIFFEUR,7000,170
B61GC005,ACCCOIFF,WMARK DENT TONDEUSE 10-PACK PREMIUM METAL CLIP B61-GC005 /GUIDE COMBO,ACCESSOIRE COIFFEUR,7000,58
B62BT001,ACCCOIFF,BARBER TOOLS STAND HOLDER B62-BT001,ACCESSOIRE COIFFEUR,3000,3
B62BT002,ACCCOIFF,BARBER TOOLS HOLDER B62-BT002,ACCESSOIRE COIFFEUR,5000,0
B63CH004,ACCCOIFF,CHAISE DE BARBIER / COIFFURE B63-CH004,ACCESSOIRE COIFFEUR,150000,8
B63CH006,ACCCOIFF,CHAISE DE BARBIER / COIFFURE B63-CH006,ACCESSOIRE COIFFEUR,150000,8
B63CH037,ACCCOIFF,CHAISE DE BARBIER / COIFFURE B63-CH037,ACCESSOIRE COIFFEUR,140000,20
B63CH042,ACCCOIFF,CHAISE DE BARBIER / COIFFURE B63-CH042 / B63-SU042,ACCESSOIRE COIFFEUR,120000,9
B96PS031,ACCCOIFF,KIKI NEWGAIN B96-PS031 OUTILS COIFFEUR / CISEAUX PEIGNET,ACCESSOIRE COIFFEUR,6000,0
BDCH808,ACCCOIFF,CHAOBA DENT TONDEUSE BLADE 808PLUS,ACCESSOIRE COIFFEUR,1000,3120
BDG2800,ACCCOIFF,NEWGAIN DENT TONDEUSE BLADE G2800,ACCESSOIRE COIFFEUR,1500,2721
BDNGA007,ACCCOIFF,NEWGAIN DENT TONDEUSE BLADE NG-A007 BOITE VERT,ACCESSOIRE COIFFEUR,1000,5412
BDT3,ACCCOIFF,WMARK DENT TONDEUSE BLADE T-3,ACCESSOIRE COIFFEUR,2500,0
BDW1,ACCCOIFF,WMARK DENT TONDEUSE BLADE W-1,ACCESSOIRE COIFFEUR,2000,1
BDW2,ACCCOIFF,WMARK DENT TONDEUSE BLADE W-2,ACCESSOIRE COIFFEUR,2000,0
BROSSE,ACCCOIFF,BROSSE PM ET GM EPONGE POUR COIFFEUR C68-FS002,ACCESSOIRE COIFFEUR,1000,0
CHAO808BA,ACCCOIFF,LAME TONDEUSE CHAO808BA,ACCESSOIRE COIFFEUR,1500,0
D30HB008,ACCCOIFF,BROSSE COIFFURE D30-HB008 / BROSSE EN PLASTIQUE GECHEN,ACCESSOIRE COIFFEUR,1000,1050
D30N008,ACCCOIFF,WMARK W-100B PAPIER COU  NOIR / NECK PAPER BLACK,ACCESSOIRE COIFFEUR,800,610
DS08BS001,ACCCOIFF,WMARK KHEER STONE CAILLOUX POUR LAME TONDEUDE  DS08-BS001,ACCESSOIRE COIFFEUR,2000,583
E66CC003,ACCCOIFF,CAPE DE COUPE IMPERMEA NEW GAIN KIKI D50-CC002 NOIR/ D50-CC003 TISSU,ACCESSOIRE COIFFEUR,2000,832
E66CC004,ACCCOIFF,CAPE DE COUPE IMPERMEABLE NEW GAIN KIKI E66-CC004 BLANC/ D50-CC007,ACCESSOIRE COIFFEUR,2000,716
G030,ACCCOIFF,RASOIR A LAME G-030,ACCESSOIRE COIFFEUR,750,356
G8,ACCCOIFF,WMARK DENT TONDEUSE G8 8-PACK PREMIUM CUTTING GUIDES G-8 /,ACCESSOIRE COIFFEUR,6500,159
LAME812,ACCCOIFF,RASOIR A LAME 812 COULEUR MIX / E77-HZ004,ACCESSOIRE COIFFEUR,1000,831
LAMESILVER,ACCCOIFF,RASOIR A LAME SILVER/ GRIS,ACCESSOIRE COIFFEUR,5000,0
NG1600,ACCCOIFF,SECHOIR A MAIN NEW GAIN KIKI NG-1600 / NG-1500 / 1500W,ACCESSOIRE COIFFEUR,10000,0
NG1800,ACCCOIFF,SECHOIR A MAIN NEW GAIN KIKI NG-1800,ACCESSOIRE COIFFEUR,7500,0
B99CH005,ACCCOIFF,CHAISE DE BARBIER / COIFFURE B99-CH005,ACCESSOIRE COIFFEUR,220000,0
B47CH019,ACCCOIFF,CHAISE DE BARBIER / COIFFURE B47-CH019,ACCESSOIRE COIFFEUR,150000,1
B76LS003,ACCCOIFF,TABLEAU DE SIGNALISATION / BARBER SHOP B76-LS003  LUMINEUSE,ACCESSOIRE COIFFEUR,20000,25
B47CH001,ACCCOIFF,CHAISE DE BARBIER / COIFFURE B47-CH001 / B47-CH001B,ACCESSOIRE COIFFEUR,250000,0
B54BP039A,ACCCOIFF,BARRE DE SIGNALISATION/ BARBER SIGN POLE 31CM LUMINEUSE/ B54-BP039A,ACCESSOIRE COIFFEUR,110000,9
B54BP039B,ACCCOIFF,BARRE DE SIGNALISATION/ BARBER SIGN POLE 31CM LUMINEUSE/ B54-BP039B,ACCESSOIRE COIFFEUR,110000,9
B54BP039C,ACCCOIFF,BARRE DE SIGNALISATION/ BARBER SIGN POLE 31CM LUMINEUSE/ B54-BP039C,ACCESSOIRE COIFFEUR,100000,9
B54BP041A,ACCCOIFF,BARRE DE SIGNALISATION/ BARBER SIGN POLE 26.5CM LUMINEUSE/ B54-BP041A,ACCESSOIRE COIFFEUR,110000,9
B54BP041B,ACCCOIFF,BARRE DE SIGNALISATION/ BARBER SIGN POLE 26.5CM LUMINEUSE/ B54-BP041B,ACCESSOIRE COIFFEUR,110000,9
B54BP041C,ACCCOIFF,BARRE DE SIGNALISATION/ BARBER SIGN POLE 26.5CM LUMINEUSE/ B54-BP041C,ACCESSOIRE COIFFEUR,110000,10
B54BP019B,ACCCOIFF,BARRE DE SIGNALISATION/ BARBER SIGN POLE 26CM LUMINEUSE/ B54-BP019B,ACCESSOIRE COIFFEUR,90000,10
B54BP019C,ACCCOIFF,BARRE DE SIGNALISATION/ BARBER SIGN POLE 26CM LUMINEUSE/ B54-BP019C,ACCESSOIRE COIFFEUR,80000,8
B54BP019D,ACCCOIFF,BARRE DE SIGNALISATION/ BARBER SIGN POLE 26CM LUMINEUSE/ B54-BP019D,ACCESSOIRE COIFFEUR,80000,8
B63CH026,ACCCOIFF,CHAISE DE BARBIER / COIFFURE B63-CH026,ACCESSOIRE COIFFEUR,250000,1
B63SU040,ACCCOIFF,LAVABO+CHAISE DE BARBIER / COIFFURE B63-SU040 SHAMPOO CHAIR,ACCESSOIRE COIFFEUR,200000,9
B63CH045,ACCCOIFF,CHAISE DE BARBIER / COIFFURE B63-CH045,ACCESSOIRE COIFFEUR,175000,8
D16BS01,ACCCOIFF,WMARK DENT TONDEUSE BLADE D16-BS001,ACCESSOIRE COIFFEUR,1500,2921
B57CH007,ACCCOIFF,CHAISE DE BARBIER / TABOURET COIFFURE B57-CH007,ACCESSOIRE COIFFEUR,12000,10
D66HS001,ACCCOIFF,LADY MARK PEIGNET ELECTRIC HOT COMBO D66-HS001,ACCESSOIRE COIFFEUR,8000,87
B21SB045,ACCCOIFF,PULVERISATEUR EN PLASTIQUE B21-SB045 BIDON,ACCESSOIRE COIFFEUR,1000,385
E95FS001,ACCCOIFF,MASSEUR PIED KIKI NEW GAIN E95-FS001 FOOT SPA,ACCESSOIRE COIFFEUR,30000,1
C72SB001,ACCCOIFF,PULVERISATEUR RECHARGEABLE KIKI NEW GAIN C72-SB001 BIDON,ACCESSOIRE COIFFEUR,10000,7
D15CC008,ACCCOIFF,CAPE DE COUPE IMPERMEABLE KIKI NEW GAIN D15-CC008,ACCESSOIRE COIFFEUR,2000,1070
D52SA001,ACCCOIFF,CAPE DE COUPE EN TISSU D52-SA001 / Bleu Clair,ACCESSOIRE COIFFEUR,2500,312
D52SA002,ACCCOIFF,CAPE DE COUPE EN TISSU D52-SA002 / Bleu Foncier,ACCESSOIRE COIFFEUR,3000,54
B60FSM015,ACCCOIFF,PROFESSIONNEL ROND FACIAL STEAMER B60-FSM015,ACCESSOIRE COIFFEUR,50000,0
CHAISE1,ACCCOIFF,CHAISE+MASSEUR PIED B04-PC051,ACCESSOIRE COIFFEUR,300000,2
CHAISE,ACCCOIFF,CHAISE BUREAU / TABOURET,ACCESSOIRE COIFFEUR,25000,0
BROSSE1,ACCCOIFF,BROSSE1 BOUT JAUNE POUR COIFFEUR BOIS BLANC ROND - OR - BRUN,ACCESSOIRE COIFFEUR,2500,781
BROSSE2,ACCCOIFF,BROSSE2 BOUT ROSE POUR COIFFEUR,ACCESSOIRE COIFFEUR,1500,101
BROSSE3,ACCCOIFF,BROSSE3 FORME PELLE POUR COIFFEUR,ACCESSOIRE COIFFEUR,1000,796
BROSSE4,ACCCOIFF,BROSSE4 FORME MIROIR POUR COIFFEUR CORDE BLANC BOIS ROUGE-LONG,ACCESSOIRE COIFFEUR,2000,994
NG3000,ACCCOIFF,MACHINE A SECHOIR NG-3000 KIKI NEWGAIN,ACCESSOIRE COIFFEUR,50000,0
BDW8,ACCCOIFF,WMARK DENT TONDEUSE BLADE W-8,ACCESSOIRE COIFFEUR,1000,333
C68FS001,ACCCOIFF,BROSSE PM ET GM EPONGE POUR COIFFEUR C68-FS001 / GM,ACCESSOIRE COIFFEUR,1000,7
B21HB000,ACCCOIFF,BROSSE DOUBLE FACE POUR COIFFEUR B21-HB000,ACCESSOIRE COIFFEUR,2000,370
C20CT043,ACCCOIFF,WMARK FER A LISSE C20-CT043,ACCESSOIRE COIFFEUR,22500,0
C20HS041,ACCCOIFF,WMARK FER A LISSE C20-HS041,ACCESSOIRE COIFFEUR,22500,0
B57CH009,ACCCOIFF,CHAISE DE BARBIER / TABOURET COIFFURE B57-CH009,ACCESSOIRE COIFFEUR,20000,22
B57CH010,ACCCOIFF,CHAISE DE BARBIER / TABOURET COIFFURE B57-CH010,ACCESSOIRE COIFFEUR,22500,31
D11CC020,ACCCOIFF,CAPE DE COUPE IMPERMEABLE TRANSPARENT KIKI NEW GAIN B11-CC020,ACCESSOIRE COIFFEUR,2250,810
E66CC001,ACCCOIFF,CAPE DE COUPE IMPERMEABLE NEW GAIN KIKI E66-CC001 VERT,ACCESSOIRE COIFFEUR,2500,0
D46CC025,ACCCOIFF,CAPE DE COUPE IMPERMEABLE NEW GAIN KIKI D46-CC025 NOIR BLANC,ACCESSOIRE COIFFEUR,2500,0
D21CC076,ACCCOIFF,CAPE DE COUPE IMPERMEABLE NEW GAIN KIKI B21-CC076 BLANC MARRON,ACCESSOIRE COIFFEUR,2000,410
B57CH008,ACCCOIFF,CHAISE DE BARBIER / TABOURET AVEC ROUE COIFFURE B57-CH008,ACCESSOIRE COIFFEUR,17500,20
BC3300,AI,GIGA 360 1D BARCODE SCANNER USB BC3300,ACCESSOIRE INFORMATIQUE,25000,0
CARDREAD,AI,LECTEUR CARTE/ CARD READER MIX,ACCESSOIRE INFORMATIQUE,150,423
CARDREAD1,AI,LECTEUR CARTE USB AVEC CHAINE / CARD READER 1 / 200pcs/pk,ACCESSOIRE INFORMATIQUE,250,64953
CLA959,AI,MULTIMEDIA KEYBOARD / CLAVIER SANS FIL USB WIRELESS 2.4GHz /959,ACCESSOIRE INFORMATIQUE,6000,193
CLAFLEXIBLE,AI,CLAVIER AVEC FIL FLEXIBLE FRANCAIS 103B/ NOIR,ACCESSOIRE INFORMATIQUE,2500,9
CLAK015,AI,CLAVIER NUMERIQUE K-015/ NOIR,ACCESSOIRE INFORMATIQUE,1500,114
CLAK06,AI,2.4G CLAVIER ORDINATEUR SANS FIL K-06 BLANC,ACCESSOIRE INFORMATIQUE,6000,81
CLAK218,AI,DELL CLAVIER AVEC FIL KB-218/ FRANCAIS+ANGLAIS,ACCESSOIRE INFORMATIQUE,2000,10
CLAMINISANSFIL,AI,MINI KEYBOARD/MINI CLAVIER SANS FIL+SOURIS/PACK BLANC/ K03/ KM901 /,ACCESSOIRE INFORMATIQUE,5000,170
CLASURFACE,AI,CLAVIER SURFACE SMART KEYBOARD FOR SURFACE  / PRO3/4/5/6 SURFACE GO,ACCESSOIRE INFORMATIQUE,17500,0
CLAVIERANDROID,AI,MINI CLAVIER ANROID BACKLIT /MINI KEYBOARD ANDROID,ACCESSOIRE INFORMATIQUE,3500,48
CLAVIERDELL,AI,DELL CLAVIER AVEC FIL ODJ331 /DELL 8115,ACCESSOIRE INFORMATIQUE,2500,659
CS700,AI,HP CLAVIER + SOURIS SANS FIL CS-700/CS700,ACCESSOIRE INFORMATIQUE,6000,566
DELKB690F,AI,DELL CLAVIER ORIGINAL AVEC FIL KB-690F/ FRANCAIS+ANGLAIS,ACCESSOIRE INFORMATIQUE,3500,0
DESSFIL,AI,DELL SOURIS SANS FIL /MOUSE WIRELESS WM123,ACCESSOIRE INFORMATIQUE,2000,0
DLINKPDB24OR,AI,D-LINK PANNEAU DE BRASSAGE 24 PORTS ORIGINAL D-LINK-PDB-24-OR,ACCESSOIRE INFORMATIQUE,25000,7
EOPN930CB,AI,CASQUE SAMSUNG LEVEL ACTIVE EO-PN930CB,ACCESSOIRE INFORMATIQUE,5000,0
FHHB010E,AI,LAVAGE ORDINATEUR HANDBOSS FH-HB010E/ 010/ 012 CLEANER,ACCESSOIRE INFORMATIQUE,750,2924
FHHB011E,AI,LAVAGE ORDINATEUR HANDBOSS FH-HB011E/ 020 CLEANER+SOUFFLEUR NOIR,ACCESSOIRE INFORMATIQUE,1000,1553
FHHB016E,AI,LAVAGE ORDINATEUR  HANDBOSS FH-HB016E,ACCESSOIRE INFORMATIQUE,1000,230
FHHB018E,AI,LAVAGE ORDINATEUR HANDBOSS FH-HB018E GM,ACCESSOIRE INFORMATIQUE,1000,509
FILMAC,AI,FIL MACBOOK DE RECHANGE / APPLE EU CABLE,ACCESSOIRE INFORMATIQUE,5000,87
FOAM,AI,HANDBOSS FOAM CLEANER /EXPERT CLEANING / MOUSSE NETTOYAGE,ACCESSOIRE INFORMATIQUE,1000,1522
FOAM530,AI,HANDBOSS FOAM 530 CLEANER CLEANING AGENT 550ML MOUSSE NETTOY FH-HB036,ACCESSOIRE INFORMATIQUE,1000,0
G102,AI,LOGITECH SOURIS AVEC FIL G102/ GAMING MOUSE / GAMEUR,ACCESSOIRE INFORMATIQUE,2000,14
GKM520,AI,CLAVIER ET SOURIS SANS FIL BLANC/NOIR GKM520 FRANCAIS-ANGLAIS,ACCESSOIRE INFORMATIQUE,5000,194
H110,AI,LOGITECH CASQUE H110,ACCESSOIRE INFORMATIQUE,8000,57
H111,AI,LOGITECH CASQUE H111,ACCESSOIRE INFORMATIQUE,8000,87
H600,AI,LOGITECH CASQUE H600 / BOUT USB,ACCESSOIRE INFORMATIQUE,35000,0
HDMIF/F,AI,HDMI Female To Female ADAPTER  EXTENDER CONNECTOR F/F FEMELLE FEMELL,ACCESSOIRE INFORMATIQUE,500,137
HK3800,AI,HK CLAVIER ORDINATEUR HK-3800 COPY,ACCESSOIRE INFORMATIQUE,6500,0
HP200OR,AI,HP SOURIS SANS FIL 200 ORIGINAL,ACCESSOIRE INFORMATIQUE,7000,0
HPCS300,AI,HP CLAVIER ORDINATEUR SANS FIL CS300 ORIGINAL,ACCESSOIRE INFORMATIQUE,17500,0
HPCS710,AI,HP CLAVIER ORDINATEUR SANS FIL CS710 ORIGINAL,ACCESSOIRE INFORMATIQUE,20000,0
HPCS900,AI,HP CLAVIER ORDINATEUR SANS FIL CS900 ORIGINAL,ACCESSOIRE INFORMATIQUE,20000,0
HPFM510A,AI,HP SOURIS SANS FIL HP-FM510A,ACCESSOIRE INFORMATIQUE,1800,0
HPFM670,AI,HP SOURIS SANS FIL HP-FM670,ACCESSOIRE INFORMATIQUE,1800,0
HPG100SOR,AI,HP SOURIS USB G100S ORIGINAL,ACCESSOIRE INFORMATIQUE,10000,0
HPK550F,AI,HP CLAVIER ORIGINAL AVEC FIL USB K550F PACKING BLEU,ACCESSOIRE INFORMATIQUE,3500,0
HPKM10,AI,HP CLAVIER ORDINATEUR AVEC FIL KM10  ORIGINAL,ACCESSOIRE INFORMATIQUE,10000,1
HPM100,AI,HP SOURIS USB +FIL M100,ACCESSOIRE INFORMATIQUE,1000,4555
HPM110,AI,HP SOURIS USB +FIL M110/FM110,ACCESSOIRE INFORMATIQUE,1000,0
HPM280,AI,HP SOURIS USB +FIL / GAMING MOUSE M280 / GAMEUR,ACCESSOIRE INFORMATIQUE,2500,3
HPPMS,AI,HP SOURIS USB AVEC FIL CRAFT PACKING PM 500FCFA,ACCESSOIRE INFORMATIQUE,400,0
HPS1000,AI,HP SOURIS SANS FIL HP-S1000,ACCESSOIRE INFORMATIQUE,1800,3264
HPS1500OR,AI,HP SOURIS SANS FIL S1500 ORIGINAL,ACCESSOIRE INFORMATIQUE,7000,0
HPS4000,AI,HP SOURIS SANS FIL HP-S4000,ACCESSOIRE INFORMATIQUE,1600,1
HPS9000,AI,HP SOURIS SANS FIL HP-S9000,ACCESSOIRE INFORMATIQUE,1800,2099
HPS9300,AI,HP SOURIS SANS FIL HP-S9300 / S9500 BLUETOOTH,ACCESSOIRE INFORMATIQUE,2000,0
HPSMALL,AI,HP SOURIS AVEC FIL HP SMALL S1600 / SJ-100 / SJ-01 PETIT CRAFT,ACCESSOIRE INFORMATIQUE,500,1294
HPSOURIS,AI,HP SOURIS AVEC FIL HP-M10 / M10,ACCESSOIRE INFORMATIQUE,1000,0
HPSSFIL,AI,WIRELESS OPTICAL LAVEROCK MOUSE/ SOURIS HP SANS FIL 2.4G,ACCESSOIRE INFORMATIQUE,1500,2
HPX500,AI,HP SOURIS USB+FIL X500/GM,ACCESSOIRE INFORMATIQUE,1000,0
HPX500OR,AI,HP SOURIS USB X500 ORIGINAL,ACCESSOIRE INFORMATIQUE,5000,0
HPX900OR,AI,HP SOURIS USB  X900 ORIGINAL,ACCESSOIRE INFORMATIQUE,5000,0
IBMK012,AI,CLAVIER IBM PAVET NUMERIQUE K-012/,ACCESSOIRE INFORMATIQUE,1500,64
K1600,AI,HP CLAVIER AVEC FIL USB K1600 PACKING BLEU,ACCESSOIRE INFORMATIQUE,2000,3
K600,AI,HP MINI CLAVIER FRANCAIS-ANGLAIS K600,ACCESSOIRE INFORMATIQUE,1600,0
KAV3USER,AI,KASPERSKY ANTIVIRUS SIMPLE 4USER,ACCESSOIRE INFORMATIQUE,13500,483
KB580,AI,ACER CLAVIER AVEC FIL KB-580,ACCESSOIRE INFORMATIQUE,1800,0
KB616,AI,DELL MINI CLAVIER KB-616,ACCESSOIRE INFORMATIQUE,1600,6
KB660,AI,LENOVO MINI CLAVIER KB-660,ACCESSOIRE INFORMATIQUE,1600,0
KB680,AI,ASUS MINI CLAVIER KB-680,ACCESSOIRE INFORMATIQUE,1600,0
KB880,AI,ASUS CLAVIER AVEC FIL KB-880,ACCESSOIRE INFORMATIQUE,1800,0
KEYLOCK,AI,F&K LAPTOP KEY LOCK / NUMBER LOCK / NOTEBOOK COMPUTER LOCK,ACCESSOIRE INFORMATIQUE,1000,27
KICA,AI,KICA VIBRATION PERCUSSION DEVICE,ACCESSOIRE INFORMATIQUE,50000,38
KIS3USER,AI,KASPERSKY ANTIVIRUS INTERNET SECURITY 4USER 2023,ACCESSOIRE INFORMATIQUE,18000,617
KM816,AI,DELL CLAVIER + SOURIS SANS FIL KM-816/KM-915,ACCESSOIRE INFORMATIQUE,5000,5
KR86,AI,A4TECH MINI CLAVIER KR-86,ACCESSOIRE INFORMATIQUE,1600,0
KSOS10USER,AI,KASPERSKY SMALL OFFICE SECURITY 10 USERCOMPUTER ET MOBILE,ACCESSOIRE INFORMATIQUE,95000,5
KSOS5USER,AI,KASPERSKY SMALL OFFICE SECURITY 5USER COMPUTER ET MOBILE,ACCESSOIRE INFORMATIQUE,60000,29
KUWBDL110,AI,KUWES TOOLS BDL-110 IMPACT PUNCH DOWN TOOL /PUNCHER,ACCESSOIRE INFORMATIQUE,15000,3
KUWBHT568,AI,KUWES TOOLS BHT-568 MODULAR CRIMPING TOOL,ACCESSOIRE INFORMATIQUE,15000,1
KUWCAT3RJ11,AI,KUWES CONNECTEUR CAT.3 RJ11 6PAC * 100 PCS,ACCESSOIRE INFORMATIQUE,5000,1
KUWKEYJAC,AI,KUWES KEYSTONE JACK 50PCS AKL-28-2621-13D,ACCESSOIRE INFORMATIQUE,1500,0
KUWKS470,AI,KUWES CABLE TRACER KS-470,ACCESSOIRE INFORMATIQUE,45000,6
KUWPDB24CAT6+,AI,KUWES PANNEAU DE BRASSAGE 24 PORTS CAT.6+,ACCESSOIRE INFORMATIQUE,25000,4
KUWPDB24CAT6A,AI,KUWES PANNEAU DE BRASSAGE 24 PORTS CAT.6A/KSNT-24ABL-C6A,ACCESSOIRE INFORMATIQUE,45000,3
KUWPDB48CAT6+,AI,KUWES PANNEAU DE BRASSAGE 48 PORTS CAT.6+/PATCH PANEL,ACCESSOIRE INFORMATIQUE,40000,0
KUWPM,AI,KUWES PLATE/PRISE MURALE 1 PORT/ 2 PORT AKL-25-6101-19,ACCESSOIRE INFORMATIQUE,1000,116
KUWSUP7100,AI,KUWSUP7100 KUWES RJ45,ACCESSOIRE INFORMATIQUE,50000,1
L0105014,AI,LO MASTER TROUSSEAU +PINCE+INFORMATIQUE / L0105014 / OUTILS,ACCESSOIRE INFORMATIQUE,18000,0
LAVAGE3IN1,AI,LAVAGE ORDINATEUR 3IN1 / CLEANSER FOR APPLE,ACCESSOIRE INFORMATIQUE,750,0
LENKB680,AI,LENOVO CLAVIER AVEC FIL KB-680,ACCESSOIRE INFORMATIQUE,1800,0
LENN100,AI,LENOVO SOURIS SANS FIL N100,ACCESSOIRE INFORMATIQUE,1800,0
LEXS5032GB,AI,CLE LEXAR S50 32GB,ACCESSOIRE INFORMATIQUE,800,0
LWEB01,AI,STICKER CLAVIER LW-KBS31 / FRANCAIS-ARABE,ACCESSOIRE INFORMATIQUE,500,4217
LWKBS31,AI,STICKER CLAVIER LW-KBS31 / FRANCAIS-ANGLAIS,ACCESSOIRE INFORMATIQUE,500,9647
M235,AI,LOGITECH SOURIS SANS FIL M235,ACCESSOIRE INFORMATIQUE,2000,0
MDRE370,AI,SONY CASQUE ORDINATEUR PM MDR-E370MV,ACCESSOIRE INFORMATIQUE,1800,0
MDRE664,AI,SONY CASQUE ORDINATEUR PM MDR-E664MV,ACCESSOIRE INFORMATIQUE,1500,0
MDRE666,AI,SONY CASQUE ORDINATEUR GM MDR-E666MV,ACCESSOIRE INFORMATIQUE,1800,0
MDRE669,AI,SONY CASQUE ORDINATEUR GM MDR-E669MV,ACCESSOIRE INFORMATIQUE,1500,0
MDRE908,AI,SONY CASQUE ORDINATEUR MDR-XB990BT / MDR-XB220BT / A85 / XB800BT,ACCESSOIRE INFORMATIQUE,5000,0
MERSOURIS,AI,MERCURY SOURIS AVEC FIL MX 1200/MX 1500 + PORT USB,ACCESSOIRE INFORMATIQUE,1500,0
MS111,AI,DELL SOURIS AVEC FIL MS111 MOUSE,ACCESSOIRE INFORMATIQUE,700,194
NEWPRO15.4RETINA,AI,PROTECTION PACK MACBOOK NEW PRO 15.4 RETINA/TOUCH,ACCESSOIRE INFORMATIQUE,-,62
NOR10USER,AI,NORTON BY SYMANTEC SECURITY 10 USER,ACCESSOIRE INFORMATIQUE,35000,0
NOR1USER,AI,NORTON BY SYMANTEC SECURITY 1 USER,ACCESSOIRE INFORMATIQUE,7000,0
NOR3USER,AI,NORTON BY SYMANTEC SECURITY 3 USER,ACCESSOIRE INFORMATIQUE,9000,0
NOR5USER,AI,NORTON BY SYMANTEC SECURITY 5 USER,ACCESSOIRE INFORMATIQUE,15000,61
ORI9548RU3,AI,ORICO 3.5 INCH EXTERNAL HDD ENCLOSURE 9548RU3,ACCESSOIRE INFORMATIQUE,125000,0
ORI9548U3,AI,ORICO 3.5 INCH EXTERNAL HDD ENCLOSURE 9548U3,ACCESSOIRE INFORMATIQUE,115000,1
PINCE,AI,PINCE A SERTIR HANLONG TOOLS HT-568 / ELECTRONC TOOLS BLEU,ACCESSOIRE INFORMATIQUE,5000,15
PNT,AI,PUNENG TESTEUR RESEAU RJ45 PN-T networks,ACCESSOIRE INFORMATIQUE,15000,43
POE16PORT,AI,SWITCH POE 16F+2G+1S PORT / EL1319P-1SEB / 16 PORT POE,ACCESSOIRE INFORMATIQUE,50000,1
PRO12RETINA,AI,PROTECTION PACK MACBOOK PRO 12 RETINA,ACCESSOIRE INFORMATIQUE,-,145
PRO13.3RETINA,AI,PROTECTION PACK MACBOOK PRO 13.3 RETINA,ACCESSOIRE INFORMATIQUE,-,62
PRO1317061708,AI,"PROTECTION PACKMACBOOK PRO 13"" TOUCH BAR 1706.1708",ACCESSOIRE INFORMATIQUE,-,159
PRO13AIR,AI,PROTECTION PACK MACBOOK AIR 13 COLLE DEVANT,ACCESSOIRE INFORMATIQUE,5000,95
PRO13INCHPRO,AI,PROTECTION PACK 13INCH MACBOOK PRO,ACCESSOIRE INFORMATIQUE,5000,80
PRO13RETINA,AI,PROTECTION PACK MACBOOK PRO 13 RETINA,ACCESSOIRE INFORMATIQUE,5000,68
PRO13TOUCHBAR,AI,PROTECTION PACK MACBOOK PRO 13 TOUCH BAR COLLE DEVANT,ACCESSOIRE INFORMATIQUE,5000,70
PRO15INCH,AI,PROTECTION MACBOOK ¨PACK PRO 15 INCH/COLLE DEVANT,ACCESSOIRE INFORMATIQUE,5000,82
